{
  "api_version": "agent-platform/v1alpha1",
  "kind": "LoopProfile",
  "metadata": {
    "id": "lop_0198f6d0-7ef0-7b0e-a0d3-5f9c96c7f411",
    "key": "react-loop-profile",
    "namespace": "development",
    "version": "1.0.0",
    "revision": 1,
    "scope": {
      "type": "tenant",
      "tenant_id": "ten_0198f6d0-7ef0-7b0e-a0d3-5f9c96c7f411"
    },
    "labels": {
      "strategy": "react"
    },
    "annotations": {},
    "content_digest": "sha256:a1b2c3d4e5f6a1b2c3d4e5f6a1b2c3d4e5f6a1b2c3d4e5f6a1b2c3d4e5f6a1b2",
    "created_at": "2026-09-01T00:00:00Z",
    "created_by": {
      "actor_type": "user",
      "actor_id": "usr_0198f6d0-7ef0-7b0e-a0d3-5f9c96c7f411",
      "tenant_id": "ten_0198f6d0-7ef0-7b0e-a0d3-5f9c96c7f411"
    }
  },
  "spec": {
    "strategy": "react",
    "max_iterations": 20,
    "max_wall_time_seconds": 3600,
    "max_model_tokens": 400000,
    "max_cost_usd": "20.00",
    "stop_conditions": [
      {
        "condition_type": "success",
        "expression": "task.completed == true"
      },
      {
        "condition_type": "failure",
        "expression": "task.error != null"
      },
      {
        "condition_type": "budget",
        "expression": "usage.cost_usd >= budget.max_cost_usd"
      },
      {
        "condition_type": "human_stop",
        "expression": "user.requested_stop == true"
      }
    ],
    "evaluator_refs": [
      {
        "kind": "SkillManifest",
        "id": "skl_0198f6d0-7ef0-7b0e-a0d3-5f9c96c7f412",
        "version": "1.0.0",
        "digest": "sha256:b2c3d4e5f6a1b2c3d4e5f6a1b2c3d4e5f6a1b2c3d4e5f6a1b2c3d4e5f6a1b2c3"
      }
    ],
    "checkpoint_policy": {
      "interval_iterations": 5,
      "on_tool_side_effect": true,
      "on_human_interrupt": true,
      "on_node_end": true
    },
    "retry_policy": {
      "max_model_retries": 3,
      "max_node_retries": 2,
      "backoff": "exponential"
    },
    "human_interrupts": [
      {
        "stage": "before_destructive_action",
        "reason": "User confirmation required for destructive operations",
        "required": true
      }
    ],
    "progress_policy": {
      "emit_every_iterations": 5,
      "persist_summary": true
    },
    "rollback_policy": {
      "strategy": "compensating_action",
      "compensation_tool_refs": [
        {
          "kind": "ToolManifest",
          "id": "tol_0198f6d0-7ef0-7b0e-a0d3-5f9c96c7f413",
          "version": "1.0.0",
          "digest": "sha256:c3d4e5f6a1b2c3d4e5f6a1b2c3d4e5f6a1b2c3d4e5f6a1b2c3d4e5f6a1b2c3d4"
        }
      ]
    }
  },
  "status": {
    "phase": "active",
    "observed_revision": 1,
    "activated_at": "2026-09-01T00:00:00Z"
  }
}
